{
  "schema_version": 1,
  "timestamp": "2026-07-25T19:01:46Z",
  "git_rev": "da4e1c899df86d9dbd0ecd6f080d3f30380f6f18",
  "release_tag": "v2.1.0",
  "preset": "standard",
  "cardano_node_version": "11.0.1",
  "cardano_cli_version": "11.0.0.0",
  "rounds": [
    {
      "name": "baseline",
      "pass": true,
      "evidence_dir": "evidence-archive/20260725T184244Z",
      "duration_seconds": 120,
      "git_rev": "da4e1c899df86d9dbd0ecd6f080d3f30380f6f18",
      "cardano_node_version": "11.0.1",
      "cardano_cli_version": "11.0.0.0",
      "blocks": {
        "total_forges": 62,
        "canonical": 62,
        "orphans": 0,
        "orphan_rate": 0.0000
      },
      "tip_age": {
        "avg_seconds": 1.44,
        "p99_seconds": 9.00
      },
      "chain_density": 0.530,
      "tx_zoo": {
        "pass": 120,
        "fail": 2,
        "skip": 0,
        "total": 125
      },
      "predicates": {
        "p1_forge_cross_check": true,
        "p2_per_bp_attribution": true,
        "p3_tx_inclusion": null,
        "p4_tip_parity": true,
        "p5_tip_age": true
      },
      "log_errors": {
        "dugite-bp": {
          "errors": 140,
          "warns": 4
        },
        "dugite-relay": {
          "errors": 1233,
          "warns": 41
        },
        "cardano-bp": {
          "errors": 1,
          "warns": 1
        }
      },
      "anomalies": [],
      "epoch_transitions_observed": 1,
      "n2n_adversarial": {
        "pass": 0,
        "fail": 0,
        "panic": 0,
        "silent_skip": 0
      },
      "cli_parity": {
        "equal": 0,
        "divergent": 0,
        "skip": 0,
        "error": 0
      }
    },
    {
      "name": "epoch-boundary",
      "pass": true,
      "evidence_dir": "evidence/20260725T184558Z",
      "duration_seconds": 900,
      "git_rev": "da4e1c899df86d9dbd0ecd6f080d3f30380f6f18",
      "cardano_node_version": "11.0.1",
      "cardano_cli_version": "11.0.0.0",
      "blocks": {
        "total_forges": 461,
        "canonical": 461,
        "orphans": 0,
        "orphan_rate": 0.0000
      },
      "tip_age": {
        "avg_seconds": 1.92,
        "p99_seconds": 7.00
      },
      "chain_density": 0.511,
      "tx_zoo": {
        "pass": 120,
        "fail": 2,
        "skip": 0,
        "total": 125
      },
      "predicates": {
        "p1_forge_cross_check": true,
        "p2_per_bp_attribution": true,
        "p3_tx_inclusion": true,
        "p4_tip_parity": true,
        "p5_tip_age": true
      },
      "log_errors": {
        "dugite-bp": {
          "errors": 285,
          "warns": 4
        },
        "dugite-relay": {
          "errors": 761,
          "warns": 7
        },
        "cardano-bp": {
          "errors": 1,
          "warns": 1
        }
      },
      "anomalies": [],
      "epoch_transitions_observed": 1,
      "n2n_adversarial": {
        "pass": 0,
        "fail": 0,
        "panic": 0,
        "silent_skip": 0
      },
      "cli_parity": {
        "equal": 0,
        "divergent": 0,
        "skip": 0,
        "error": 0
      }
    },
    {
      "name": "restart",
      "pass": true,
      "evidence_dir": "evidence-archive/20260725T182827Z",
      "duration_seconds": 60,
      "git_rev": "da4e1c899df86d9dbd0ecd6f080d3f30380f6f18",
      "cardano_node_version": "11.0.1",
      "cardano_cli_version": "11.0.0.0",
      "blocks": {
        "total_forges": 32,
        "canonical": 32,
        "orphans": 0,
        "orphan_rate": 0.0000
      },
      "tip_age": {
        "avg_seconds": 1.21,
        "p99_seconds": 6.00
      },
      "chain_density": 0.500,
      "tx_zoo": {
        "pass": 120,
        "fail": 2,
        "skip": 0,
        "total": 125
      },
      "predicates": {
        "p1_forge_cross_check": true,
        "p2_per_bp_attribution": true,
        "p3_tx_inclusion": null,
        "p4_tip_parity": true,
        "p5_tip_age": null
      },
      "log_errors": {
        "dugite-bp": {
          "errors": 27,
          "warns": 9
        },
        "dugite-relay": {
          "errors": 21,
          "warns": 5
        },
        "cardano-bp": {
          "errors": 1,
          "warns": 1
        }
      },
      "anomalies": [],
      "epoch_transitions_observed": 2,
      "n2n_adversarial": {
        "pass": 0,
        "fail": 0,
        "panic": 0,
        "silent_skip": 0
      },
      "cli_parity": {
        "equal": 0,
        "divergent": 0,
        "skip": 0,
        "error": 0
      }
    }
  ],
  "summary": {
    "pass": true,
    "rounds_pass": 3,
    "rounds_fail": 0,
    "total_canonical_blocks": 555,
    "total_tx_zoo_pass": 360,
    "total_tx_zoo_fail": 6,
    "invalid_forges_detected": 0,
    "critical_anomalies": 0
  },
  "trend": null
}
