{
  "schema_version": 1,
  "timestamp": "2026-06-12T04:52:24Z",
  "git_rev": "ddb57bfb8d5f820881821589bf316829f86a31ce",
  "release_tag": null,
  "preset": "extended",
  "cardano_node_version": "11.0.1",
  "cardano_cli_version": "11.0.0.0",
  "rounds": [
    {
      "name": "baseline",
      "pass": true,
      "evidence_dir": "evidence-kept/round1-20260612T035851Z",
      "duration_seconds": 180,
      "git_rev": "ddb57bfb8d5f820881821589bf316829f86a31ce",
      "cardano_node_version": "11.0.1",
      "cardano_cli_version": "11.0.0.0",
      "blocks": {
        "total_forges": 89,
        "canonical": 89,
        "orphans": 0,
        "orphan_rate": 0.0000
      },
      "tip_age": {
        "avg_seconds": 1.64,
        "p99_seconds": 4.00
      },
      "chain_density": 0.494,
      "tx_zoo": {
        "pass": 0,
        "fail": 0,
        "skip": 0,
        "total": 0
      },
      "predicates": {
        "p1_forge_cross_check": true,
        "p2_per_bp_attribution": true,
        "p3_tx_inclusion": true,
        "p4_tip_parity": true,
        "p5_tip_age": true
      },
      "log_errors": {
        "dugite-bp": {
          "errors": 1,
          "warns": 4
        },
        "dugite-relay": {
          "errors": 21,
          "warns": 39
        },
        "cardano-bp": {
          "errors": 1,
          "warns": 1
        }
      },
      "anomalies": [],
      "epoch_transitions_observed": 1,
      "n2n_adversarial": {
        "pass": 0,
        "fail": 0,
        "panic": 0,
        "silent_skip": 0
      },
      "cli_parity": {
        "equal": 0,
        "divergent": 0,
        "skip": 0,
        "error": 0
      }
    },
    {
      "name": "epoch-boundary",
      "pass": true,
      "evidence_dir": "evidence-kept/round2-20260612T041027Z",
      "duration_seconds": 180,
      "git_rev": "ddb57bfb8d5f820881821589bf316829f86a31ce",
      "cardano_node_version": "11.0.1",
      "cardano_cli_version": "11.0.0.0",
      "blocks": {
        "total_forges": 93,
        "canonical": 93,
        "orphans": 0,
        "orphan_rate": 0.0000
      },
      "tip_age": {
        "avg_seconds": 0.62,
        "p99_seconds": 3.00
      },
      "chain_density": 0.514,
      "tx_zoo": {
        "pass": 0,
        "fail": 0,
        "skip": 0,
        "total": 0
      },
      "predicates": {
        "p1_forge_cross_check": true,
        "p2_per_bp_attribution": true,
        "p3_tx_inclusion": true,
        "p4_tip_parity": true,
        "p5_tip_age": true
      },
      "log_errors": {
        "dugite-bp": {
          "errors": 1,
          "warns": 4
        },
        "dugite-relay": {
          "errors": 21,
          "warns": 38
        },
        "cardano-bp": {
          "errors": 1,
          "warns": 1
        }
      },
      "anomalies": [],
      "epoch_transitions_observed": 1,
      "n2n_adversarial": {
        "pass": 0,
        "fail": 0,
        "panic": 0,
        "silent_skip": 0
      },
      "cli_parity": {
        "equal": 0,
        "divergent": 0,
        "skip": 0,
        "error": 0
      }
    },
    {
      "name": "restart",
      "pass": true,
      "evidence_dir": "evidence-kept/round3-20260612T044049Z",
      "duration_seconds": 180,
      "git_rev": "ddb57bfb8d5f820881821589bf316829f86a31ce",
      "cardano_node_version": "11.0.1",
      "cardano_cli_version": "11.0.0.0",
      "blocks": {
        "total_forges": 90,
        "canonical": 90,
        "orphans": 0,
        "orphan_rate": 0.0000
      },
      "tip_age": {
        "avg_seconds": 1.81,
        "p99_seconds": 8.00
      },
      "chain_density": 0.542,
      "tx_zoo": {
        "pass": 0,
        "fail": 0,
        "skip": 0,
        "total": 0
      },
      "predicates": {
        "p1_forge_cross_check": true,
        "p2_per_bp_attribution": true,
        "p3_tx_inclusion": true,
        "p4_tip_parity": true,
        "p5_tip_age": true
      },
      "log_errors": {
        "dugite-bp": {
          "errors": 1,
          "warns": 4
        },
        "dugite-relay": {
          "errors": 20,
          "warns": 37
        },
        "cardano-bp": {
          "errors": 1,
          "warns": 1
        }
      },
      "anomalies": [],
      "epoch_transitions_observed": 1,
      "n2n_adversarial": {
        "pass": 0,
        "fail": 0,
        "panic": 0,
        "silent_skip": 0
      },
      "cli_parity": {
        "equal": 0,
        "divergent": 0,
        "skip": 0,
        "error": 0
      }
    }
  ],
  "summary": {
    "pass": true,
    "rounds_pass": 3,
    "rounds_fail": 0,
    "total_canonical_blocks": 272,
    "total_tx_zoo_pass": 0,
    "total_tx_zoo_fail": 0,
    "invalid_forges_detected": 0,
    "critical_anomalies": 0
  },
  "trend": null
}
